{
  "$schema": "https://json-schema.org/draft/2020-12/schema",
  "$id": "https://raw.githubusercontent.com/manjunathhk/social-card-generator/main/schema/card.schema.json",
  "title": "Social card source",
  "description": "A JSON card, or the YAML front matter plus panels of a Markdown card. A code card (the default) has panels; a diagram card (\"kind\": \"diagram\", JSON only) has a diagram. Character and count limits are enforced here; per-panel line limits are listed as x-maxLines per layout. A card that passes this schema can still fail to fit (code at the minimum font size, a diagram taller than its space), which only a real render detects. Rules that span fields (anchors naming real nodes, edge types naming legend ids, nodes not sharing a cell, 8-character labels on left/right edges) are checked by the renderer, not here.",
  "type": "object",
  "required": ["title", "subtitle"],
  "properties": {
    "$schema": {
      "type": "string",
      "description": "Optional URL of this schema, for editor autocomplete. Ignored by the renderer."
    },
    "kind": {
      "description": "What the card body is: \"code\" panels, or a \"diagram\" of nodes and edges (JSON only).",
      "enum": ["code", "diagram"],
      "default": "code"
    },
    "title": {
      "type": "string",
      "description": "First title line. At most 70 characters.",
      "pattern": "\\S",
      "maxLength": 70
    },
    "highlight": {
      "type": "string",
      "description": "Second title line, in the accent colour. At most 70 characters.",
      "maxLength": 70
    },
    "subtitle": {
      "type": "string",
      "description": "One or two sentences under the title. At most 150 characters.",
      "pattern": "\\S",
      "maxLength": 150
    },
    "tags": {
      "type": "array",
      "description": "Up to 3 short tags.",
      "maxItems": 3,
      "items": { "type": "string", "description": "A tag. At most 22 characters.", "pattern": "\\S", "maxLength": 22 },
      "default": []
    },
    "insight": {
      "type": "string",
      "description": "The \"design note\" under the panels. At most 220 characters.",
      "maxLength": 220
    },
    "issue": {
      "type": "string",
      "description": "Issue number shown in a running head at the top. Omit it and the card shows no issue number. At most 12 characters.",
      "maxLength": 12
    },
    "layout": {
      "description": "Panel arrangement. \"stack\": 1 to 2 panels; at most 18 lines per panel with 1 panel, 9 lines per panel with 2 panels; code font 28 to 18 px. \"columns\": 2 panels; at most 16 code lines per panel; code font 22 to 15 px. \"grid\": 3 to 4 panels; at most 10 code lines per panel; code font 20 to 14 px.",
      "enum": ["stack", "columns", "grid"],
      "default": "stack"
    },
    "theme": { "description": "Palette, typefaces and panel shape.", "enum": ["light", "dark"], "default": "light" },
    "panels": {
      "type": "array",
      "description": "Code panels, in order. How many depends on the layout. Code cards only.",
      "items": { "$ref": "#/$defs/panel" }
    },
    "diagram": { "$ref": "#/$defs/diagram" }
  },
  "allOf": [
    {
      "if": { "required": ["kind"], "properties": { "kind": { "const": "diagram" } } },
      "then": { "required": ["diagram"], "not": { "anyOf": [{ "required": ["layout"] }, { "required": ["panels"] }] } },
      "else": { "required": ["panels"], "not": { "required": ["diagram"] } }
    },
    {
      "if": { "properties": { "layout": { "const": "stack" } } },
      "then": {
        "description": "\"stack\": 1 to 2 panels; at most 18 lines per panel with 1 panel, 9 lines per panel with 2 panels; code font 28 to 18 px.",
        "x-maxLines": { "1": 18, "2": 9 },
        "x-fontRange": { "max": 28, "min": 18 },
        "properties": { "panels": { "minItems": 1, "maxItems": 2 } }
      }
    },
    {
      "if": { "required": ["layout"], "properties": { "layout": { "const": "columns" } } },
      "then": {
        "description": "\"columns\": 2 panels; at most 16 code lines per panel; code font 22 to 15 px.",
        "x-maxLines": { "2": 16 },
        "x-fontRange": { "max": 22, "min": 15 },
        "properties": { "panels": { "minItems": 2, "maxItems": 2 } }
      }
    },
    {
      "if": { "required": ["layout"], "properties": { "layout": { "const": "grid" } } },
      "then": {
        "description": "\"grid\": 3 to 4 panels; at most 10 code lines per panel; code font 20 to 14 px.",
        "x-maxLines": { "3": 10, "4": 10 },
        "x-fontRange": { "max": 20, "min": 14 },
        "properties": { "panels": { "minItems": 3, "maxItems": 4 } }
      }
    }
  ],
  "$defs": {
    "anchor": {
      "type": "string",
      "description": "A point on a node: \"node.side\" or \"node.side@0.3\", where side is top, bottom, left, right and the fraction (default 0.5) runs left to right or top to bottom.",
      "pattern": "^[A-Za-z][\\w-]*\\.(top|bottom|left|right)(@(0(\\.\\d+)?|1(\\.0+)?|\\.\\d+))?$"
    },
    "diagram": {
      "type": "object",
      "description": "Diagram cards only. Nodes on a 3-column grid, edges between anchors, and a legend each edge type refers to.",
      "required": ["legend", "nodes", "edges"],
      "properties": {
        "legend": { "type": "array", "minItems": 1, "maxItems": 5, "items": { "$ref": "#/$defs/legendEntry" } },
        "nodes": { "type": "array", "minItems": 1, "maxItems": 10, "items": { "$ref": "#/$defs/node" } },
        "groups": { "type": "array", "maxItems": 2, "items": { "$ref": "#/$defs/group" }, "default": [] },
        "edges": { "type": "array", "maxItems": 14, "items": { "$ref": "#/$defs/edge" } }
      }
    },
    "legendEntry": {
      "type": "object",
      "required": ["id", "label", "tone"],
      "properties": {
        "id": {
          "type": "string",
          "pattern": "^[A-Za-z][\\w-]*$",
          "maxLength": 24,
          "description": "Letters, digits, \"-\" or \"_\", starting with a letter."
        },
        "label": {
          "type": "string",
          "description": "Legend text. At most 24 characters.",
          "pattern": "\\S",
          "maxLength": 24
        },
        "tone": {
          "enum": ["info", "accent", "success", "danger", "muted"],
          "description": "Colour role; the theme decides the colour."
        },
        "dashed": { "type": "boolean", "default": false }
      }
    },
    "node": {
      "type": "object",
      "required": ["id", "col", "row", "title"],
      "properties": {
        "id": {
          "type": "string",
          "pattern": "^[A-Za-z][\\w-]*$",
          "maxLength": 24,
          "description": "Letters, digits, \"-\" or \"_\", starting with a letter."
        },
        "col": { "type": "integer", "minimum": 1, "maximum": 3, "description": "Grid column, 1 to 3." },
        "row": { "type": "integer", "minimum": 1, "maximum": 5, "description": "Grid row, 1 to 5." },
        "colSpan": { "type": "integer", "minimum": 1, "maximum": 3, "default": 1 },
        "rowSpan": { "type": "integer", "minimum": 1, "maximum": 5, "default": 1 },
        "eyebrow": {
          "type": "string",
          "description": "Small caps line above the title. At most 22 characters.",
          "maxLength": 22
        },
        "badge": {
          "type": "string",
          "description": "Short tag before the title, e.g. \".NET\". At most 8 characters.",
          "maxLength": 8
        },
        "title": {
          "type": "string",
          "description": "Node title. At most 26 characters.",
          "pattern": "\\S",
          "maxLength": 26
        },
        "lines": {
          "type": "array",
          "maxItems": 3,
          "items": {
            "type": "string",
            "description": "A line under the title. At most 60 characters.",
            "pattern": "\\S",
            "maxLength": 60
          }
        },
        "mono": {
          "type": "boolean",
          "default": false,
          "description": "Lines in the monospace face, for paths and names."
        },
        "tone": {
          "enum": ["info", "accent", "success", "danger", "muted"],
          "description": "accent, danger, info or success tint the border; muted is a dashed note."
        }
      }
    },
    "group": {
      "type": "object",
      "required": ["id", "label", "col", "row", "colSpan"],
      "properties": {
        "id": {
          "type": "string",
          "pattern": "^[A-Za-z][\\w-]*$",
          "maxLength": 24,
          "description": "Letters, digits, \"-\" or \"_\", starting with a letter."
        },
        "label": {
          "type": "string",
          "description": "Caption on the frame. At most 60 characters.",
          "pattern": "\\S",
          "maxLength": 60
        },
        "col": { "type": "integer", "minimum": 1, "maximum": 3, "description": "Grid column, 1 to 3." },
        "row": { "type": "integer", "minimum": 1, "maximum": 5, "description": "Grid row, 1 to 5." },
        "colSpan": { "type": "integer", "minimum": 1, "maximum": 3, "default": 1 },
        "rowSpan": { "type": "integer", "minimum": 1, "maximum": 5, "default": 1 }
      }
    },
    "edge": {
      "type": "object",
      "required": ["from", "to", "type"],
      "properties": {
        "from": {
          "oneOf": [
            { "$ref": "#/$defs/anchor" },
            { "type": "array", "minItems": 1, "maxItems": 4, "items": { "$ref": "#/$defs/anchor" } }
          ]
        },
        "to": {
          "oneOf": [
            { "$ref": "#/$defs/anchor" },
            { "type": "array", "minItems": 1, "maxItems": 4, "items": { "$ref": "#/$defs/anchor" } }
          ]
        },
        "type": { "type": "string", "pattern": "^[A-Za-z][\\w-]*$", "maxLength": 24, "description": "A legend id." },
        "label": {
          "type": "string",
          "description": "Edge label. An edge between two left/right anchors sits in a column gutter and allows 8 characters. At most 20 characters.",
          "maxLength": 20
        },
        "sublabel": {
          "type": "string",
          "description": "Smaller second line; needs a label. At most 24 characters.",
          "maxLength": 24
        },
        "labelSide": { "enum": ["above", "below", "left", "right"] },
        "busOffset": {
          "type": "integer",
          "minimum": 0,
          "maximum": 160,
          "description": "Bus edges only: px from the many-ended side to the bus line."
        }
      }
    },
    "panel": {
      "type": "object",
      "required": ["language", "code"],
      "properties": {
        "label": {
          "type": "string",
          "description": "Panel header text. Defaults to the language name. At most 45 characters.",
          "pattern": "\\S",
          "maxLength": 45
        },
        "language": {
          "type": "string",
          "description": "A Shiki language id or alias, e.g. \"csharp\", \"cs\", \"ts\", \"yaml\", \"jsonc\".",
          "pattern": "\\S"
        },
        "code": {
          "type": "string",
          "description": "The code. Line limit per panel depends on the layout (see x-maxLines). At most 4000 characters.",
          "pattern": "\\S",
          "maxLength": 4000
        },
        "highlightLines": {
          "type": "array",
          "description": "One-based line numbers to highlight; each must be within the code.",
          "items": { "type": "integer", "minimum": 1 }
        },
        "underline": {
          "type": "array",
          "description": "Up to 6 exact single-line substrings of the code to underline.",
          "maxItems": 6,
          "items": { "type": "string", "minLength": 1, "pattern": "^[^\\n]*$" }
        },
        "verdict": { "description": "Tick or cross badge and header tint.", "enum": ["good", "bad"] },
        "notes": {
          "type": "array",
          "description": "Up to 3 short bullet points under the code.",
          "maxItems": 3,
          "items": {
            "type": "string",
            "description": "A note. At most 70 characters.",
            "pattern": "\\S",
            "maxLength": 70
          }
        }
      }
    }
  }
}
