{
  "title": "Cache expiration",
  "highlight": "Before / After",
  "subtitle": "A sliding window can keep a hot key alive indefinitely.",
  "tags": [".NET", "Redis", "Expiration"],
  "issue": "02",
  "insight": "Sliding expiration removes idle entries. Absolute expiration caps each entry's lifetime. Invalidate on writes when freshness matters.",
  "panels": [
    {
      "label": "BEFORE / sliding expiration only",
      "language": "csharp",
      "verdict": "bad",
      "code": "await cache.SetStringAsync(key, json, new()\n{\n    SlidingExpiration =\n        TimeSpan.FromMinutes(2)\n}, ct);"
    },
    {
      "label": "AFTER / add an absolute lifetime",
      "language": "csharp",
      "verdict": "good",
      "highlightLines": [5, 6],
      "code": "await cache.SetStringAsync(key, json, new()\n{\n    SlidingExpiration =\n        TimeSpan.FromMinutes(2),\n    AbsoluteExpirationRelativeToNow =\n        TimeSpan.FromMinutes(10)\n}, ct);"
    }
  ]
}
